{
  "schemaVersion": 1,
  "generatedAt": "2026-10-18T09:37:50.666Z",
  "page": 1,
  "pageSize": 24,
  "totalPages": 1,
  "totalCount": 9,
  "nextPage": null,
  "previousPage": null,
  "packages": [
    {
      "id": "spassglas.biom-kompass",
      "name": "Biom-Kompass",
      "author": "Spassglas Studio",
      "category": "addon",
      "license": "CC-BY-4.0",
      "latestVersion": "1.0.0",
      "updatedAt": "2026-10-14T16:41:43Z",
      "icon": "https://raw.githubusercontent.com/umgekocht/vitrine-packs-starter/main/biom-kompass/icon.png",
      "shortDescription": "Zeigt dein aktuelles Biom als HUD-Wert, begruesst dich beim Weltbeitritt mit einem Ton und sagt per Chat-Befehl '/v biom' dein Biom erneut an. Reines Skript-...",
      "minecraftVersions": [
        "1.21.1"
      ]
    },
    {
      "id": "spassglas.holzbretter-textur",
      "name": "Holzbretter",
      "author": "Spassglas Studio",
      "category": "texturen",
      "license": "CC-BY-4.0",
      "latestVersion": "1.0.1",
      "updatedAt": "2026-10-05T22:39:30.851Z",
      "icon": "https://raw.githubusercontent.com/umgekocht/vitrine-packs-starter/main/holzbretter-textur/icon.png",
      "shortDescription": "Platzhalter-Holzbretter in drei Brauntoenen -- Eiche, Fichte, Birke. Ersetzt vanilla, bis ein handgezeichnetes Set nachkommt."
    },
    {
      "id": "spassglas.knapp-deutsch",
      "name": "Knapp-Deutsch",
      "author": "Spassglas Studio",
      "category": "sprache",
      "license": "CC-BY-4.0",
      "latestVersion": "1.0.1",
      "updatedAt": "2026-10-05T22:39:30.870Z",
      "icon": "https://raw.githubusercontent.com/umgekocht/vitrine-packs-starter/main/knapp-deutsch/icon.png",
      "shortDescription": "Kurze deutsche Menütexte: Allein, Zusammen, Weiter -- statt der langen Originale. Ohne Neustart."
    },
    {
      "id": "spassglas.kompakt-hud",
      "name": "Kompakt-HUD",
      "author": "Spassglas Studio",
      "category": "hud",
      "license": "CC-BY-4.0",
      "latestVersion": "1.0.1",
      "updatedAt": "2026-10-05T22:39:30.884Z",
      "icon": "https://raw.githubusercontent.com/umgekocht/vitrine-packs-starter/main/kompakt-hud/icon.png",
      "shortDescription": "Platzsparendes HUD-Modul: Koordinaten, Uhrzeit und Fps kompakt in einer Ecke."
    },
    {
      "id": "spassglas.mehr-rezepte",
      "name": "Mehr Rezepte",
      "author": "Spassglas Studio",
      "category": "addon",
      "license": "CC-BY-4.0",
      "latestVersion": "1.0.0",
      "updatedAt": "2026-10-12T16:12:14Z",
      "icon": "https://raw.githubusercontent.com/umgekocht/vitrine-packs-starter/main/mehr-rezepte/icon.png",
      "shortDescription": "Neue Crafting-Rezepte: Sattel aus Leder, Namensschild aus Papier und Faden, Faden aus Wolle. Wirkt sofort in deiner Welt, ohne Neustart."
    },
    {
      "id": "spassglas.mitternacht-theme",
      "name": "Mitternacht",
      "author": "Spassglas Studio",
      "category": "theme",
      "license": "CC-BY-4.0",
      "latestVersion": "1.0.1",
      "updatedAt": "2026-10-05T22:39:30.899Z",
      "icon": "https://raw.githubusercontent.com/umgekocht/vitrine-packs-starter/main/mitternacht-theme/icon.png",
      "shortDescription": "Dunkles Store-Theme mit hohem Kontrast fuer Sessions am Abend."
    },
    {
      "id": "spassglas.steinbrocken-textur",
      "name": "Steinbrocken",
      "author": "Spassglas Studio",
      "category": "texturen",
      "license": "CC-BY-4.0",
      "latestVersion": "1.0.1",
      "updatedAt": "2026-10-05T22:39:30.913Z",
      "icon": "https://raw.githubusercontent.com/umgekocht/vitrine-packs-starter/main/steinbrocken-textur/icon.png",
      "shortDescription": "Platzhalter-Steintexturen im rauen Grauton -- Stein, Pflasterstein, Eisenerz. Ersetzt vanilla, bis ein handgezeichnetes Set nachkommt.",
      "minecraftVersions": [
        "1.21.1",
        "1.21.4"
      ]
    },
    {
      "id": "spassglas.tageslicht-theme",
      "name": "Tageslicht",
      "author": "Spassglas Studio",
      "category": "theme",
      "license": "CC-BY-4.0",
      "latestVersion": "1.0.1",
      "updatedAt": "2026-10-05T22:39:30.927Z",
      "icon": "https://raw.githubusercontent.com/umgekocht/vitrine-packs-starter/main/tageslicht-theme/icon.png",
      "shortDescription": "Warmes Store-Theme mit Bernstein-Akzent -- hell am Tag, ruhig am Abend."
    },
    {
      "id": "vitrine.uhr",
      "name": "Vitrine Uhr",
      "author": "Vitrine",
      "category": "hud",
      "license": "MIT",
      "latestVersion": "1.0.0",
      "updatedAt": "2026-10-18T09:36:07.210Z",
      "shortDescription": "Dezentes HUD: Uhrzeit oben rechts, FPS oben links und Koordinaten unten links. Rein deklarativ, ohne Code."
    }
  ]
}
